{
  "schema_version": "1.0.0",
  "feed_type": "robot_detail",
  "robot_id": "P2-05",
  "t_s": 11400,
  "sim_time": "2027-03-01T03:10:00Z",
  "status": "STANDBY",
  "mission_id": null,
  "op_mode": "IDLE",
  "snapshot": {
    "schema_version": "1.0.0",
    "robot_id": "P2-05",
    "robot_type": "P2_TRANSPORT",
    "t_s": 11400,
    "timestamp": "2027-03-01T03:10:00Z",
    "op_mode": "IDLE",
    "status": "NORMAL",
    "health_score": 100,
    "subsystems": [
      {
        "subsystem": "MOBILITY",
        "status": "NORMAL",
        "components": [
          {
            "component": "wheel_fl_drive",
            "status": "NORMAL",
            "channels": [
              {
                "channel": "wheel_fl_current_a",
                "units": "A",
                "value": 0.013,
                "baseline": 0.0,
                "deviation": 0.013,
                "status": "NORMAL",
                "rule": null
              },
              {
                "channel": "wheel_fl_speed_rads",
                "units": "rad/s",
                "value": 0.0,
                "baseline": 0.0,
                "deviation": 0.0,
                "status": "NORMAL",
                "rule": null
              }
            ]
          },
          {
            "component": "wheel_fr_drive",
            "status": "NORMAL",
            "channels": [
              {
                "channel": "wheel_fr_current_a",
                "units": "A",
                "value": 0.006,
                "baseline": 0.0,
                "deviation": 0.006,
                "status": "NORMAL",
                "rule": null
              },
              {
                "channel": "wheel_fr_speed_rads",
                "units": "rad/s",
                "value": 0.0,
                "baseline": 0.0,
                "deviation": 0.0,
                "status": "NORMAL",
                "rule": null
              }
            ]
          },
          {
            "component": "wheel_rl_drive",
            "status": "NORMAL",
            "channels": [
              {
                "channel": "wheel_rl_current_a",
                "units": "A",
                "value": 0.008,
                "baseline": 0.0,
                "deviation": 0.008,
                "status": "NORMAL",
                "rule": null
              },
              {
                "channel": "wheel_rl_speed_rads",
                "units": "rad/s",
                "value": 0.0,
                "baseline": 0.0,
                "deviation": 0.0,
                "status": "NORMAL",
                "rule": null
              }
            ]
          },
          {
            "component": "wheel_rr_drive",
            "status": "NORMAL",
            "channels": [
              {
                "channel": "wheel_rr_current_a",
                "units": "A",
                "value": 0.025,
                "baseline": 0.0,
                "deviation": 0.025,
                "status": "NORMAL",
                "rule": null
              },
              {
                "channel": "wheel_rr_speed_rads",
                "units": "rad/s",
                "value": 0.0,
                "baseline": 0.0,
                "deviation": 0.0,
                "status": "NORMAL",
                "rule": null
              }
            ]
          }
        ]
      },
      {
        "subsystem": "THERMAL",
        "status": "NORMAL",
        "components": [
          {
            "component": "wheel_fl_thermal",
            "status": "NORMAL",
            "channels": [
              {
                "channel": "wheel_fl_temp_c",
                "units": "degC",
                "value": 19.61,
                "baseline": 20.0,
                "deviation": -0.39,
                "status": "NORMAL",
                "rule": null
              }
            ]
          },
          {
            "component": "wheel_fr_thermal",
            "status": "NORMAL",
            "channels": [
              {
                "channel": "wheel_fr_temp_c",
                "units": "degC",
                "value": 20.17,
                "baseline": 20.0,
                "deviation": 0.17,
                "status": "NORMAL",
                "rule": null
              }
            ]
          },
          {
            "component": "wheel_rl_thermal",
            "status": "NORMAL",
            "channels": [
              {
                "channel": "wheel_rl_temp_c",
                "units": "degC",
                "value": 19.96,
                "baseline": 20.0,
                "deviation": -0.04,
                "status": "NORMAL",
                "rule": null
              }
            ]
          },
          {
            "component": "wheel_rr_thermal",
            "status": "NORMAL",
            "channels": [
              {
                "channel": "wheel_rr_temp_c",
                "units": "degC",
                "value": 19.92,
                "baseline": 20.0,
                "deviation": -0.08,
                "status": "NORMAL",
                "rule": null
              }
            ]
          }
        ]
      },
      {
        "subsystem": "POWER",
        "status": "NORMAL",
        "components": [
          {
            "component": "battery_pack",
            "status": "NORMAL",
            "channels": [
              {
                "channel": "battery_voltage_v",
                "units": "V",
                "value": 52.087,
                "baseline": 52.102,
                "deviation": -0.015,
                "status": "NORMAL",
                "rule": null
              },
              {
                "channel": "battery_current_a",
                "units": "A",
                "value": 1.24,
                "baseline": 1.25,
                "deviation": -0.01,
                "status": "NORMAL",
                "rule": null
              },
              {
                "channel": "battery_soc_pct",
                "units": "%",
                "value": 89.1,
                "baseline": null,
                "deviation": null,
                "status": "NORMAL",
                "rule": null
              }
            ]
          }
        ]
      },
      {
        "subsystem": "MECHANISMS",
        "status": "NORMAL",
        "components": [
          {
            "component": "lift_actuator",
            "status": "NORMAL",
            "channels": [
              {
                "channel": "lift_joint_current_a",
                "units": "A",
                "value": 0.017,
                "baseline": 0.0,
                "deviation": 0.017,
                "status": "NORMAL",
                "rule": null
              },
              {
                "channel": "lift_joint_pos_err_deg",
                "units": "deg",
                "value": 0.063,
                "baseline": 0.05,
                "deviation": 0.013,
                "status": "NORMAL",
                "rule": null
              }
            ]
          }
        ]
      }
    ]
  },
  "series": {
    "t_s": [4200, 4260, 4320, 4380, 4440, 4500, 4560, 4620, 4680, 4740, 4800, 4860, 4920, 4980, 5040, 5100, 5160, 5220, 5280, 5340, 5400, 5460, 5520, 5580, 5640, 5700, 5760, 5820, 5880, 5940, 6000, 6060, 6120, 6180, 6240, 6300, 6360, 6420, 6480, 6540, 6600, 6660, 6720, 6780, 6840, 6900, 6960, 7020, 7080, 7140, 7200, 7260, 7320, 7380, 7440, 7500, 7560, 7620, 7680, 7740, 7800, 7860, 7920, 7980, 8040, 8100, 8160, 8220, 8280, 8340, 8400, 8460, 8520, 8580, 8640, 8700, 8760, 8820, 8880, 8940, 9000, 9060, 9120, 9180, 9240, 9300, 9360, 9420, 9480, 9540, 9600, 9660, 9720, 9780, 9840, 9900, 9960, 10020, 10080, 10140, 10200, 10260, 10320, 10380, 10440, 10500, 10560, 10620, 10680, 10740, 10800, 10860, 10920, 10980, 11040, 11100, 11160, 11220, 11280, 11340, 11400],
    "op_mode": ["IDLE", "IDLE", "IDLE", "IDLE", "IDLE", "IDLE", "IDLE", "IDLE", "IDLE", "IDLE", "IDLE", "IDLE", "IDLE", "IDLE", "IDLE", "IDLE", "IDLE", "IDLE", "IDLE", "IDLE", "IDLE", "IDLE", "IDLE", "IDLE", "IDLE", "IDLE", "IDLE", "IDLE", "IDLE", "IDLE", "IDLE", "IDLE", "IDLE", "IDLE", "IDLE", "IDLE", "IDLE", "IDLE", "IDLE", "IDLE", "IDLE", "IDLE", "IDLE", "IDLE", "IDLE", "IDLE", "IDLE", "IDLE", "IDLE", "IDLE", "IDLE", "IDLE", "IDLE", "IDLE", "IDLE", "IDLE", "IDLE", "IDLE", "IDLE", "IDLE", "IDLE", "IDLE", "IDLE", "IDLE", "IDLE", "IDLE", "IDLE", "IDLE", "IDLE", "IDLE", "IDLE", "IDLE", "IDLE", "IDLE", "IDLE", "IDLE", "IDLE", "IDLE", "IDLE", "IDLE", "IDLE", "IDLE", "IDLE", "IDLE", "IDLE", "IDLE", "IDLE", "IDLE", "IDLE", "IDLE", "IDLE", "IDLE", "IDLE", "IDLE", "IDLE", "IDLE", "IDLE", "IDLE", "IDLE", "IDLE", "IDLE", "IDLE", "IDLE", "IDLE", "IDLE", "IDLE", "IDLE", "IDLE", "IDLE", "IDLE", "IDLE", "IDLE", "IDLE", "IDLE", "IDLE", "IDLE", "IDLE", "IDLE", "IDLE", "IDLE", "IDLE"],
    "channels": [
      {
        "channel": "wheel_fl_current_a",
        "label": "Front-left drive motor current",
        "units": "A",
        "component": "wheel_fl_drive",
        "subsystem": "MOBILITY",
        "value": [0.0, 0.011, 0.012, 0.001, 0.003, 0.004, 0.007, 0.001, 0.014, 0.008, 0.01, 0.004, 0.011, 0.003, 0.005, 0.003, 0.002, 0.004, 0.004, 0.001, 0.007, 0.009, 0.005, 0.006, 0.01, 0.004, 0.008, 0.007, 0.009, 0.001, 0.011, 0.0, 0.014, 0.004, 0.021, 0.005, 0.016, 0.012, 0.011, 0.004, 0.012, 0.003, 0.004, 0.014, 0.004, 0.002, 0.005, 0.013, 0.004, 0.012, 0.005, 0.004, 0.011, 0.01, 0.004, 0.011, 0.011, 0.001, 0.006, 0.012, 0.003, 0.008, 0.001, 0.003, 0.014, 0.003, 0.007, 0.02, 0.012, 0.005, 0.005, 0.011, 0.008, 0.013, 0.0, 0.005, 0.004, 0.007, 0.016, 0.007, 0.001, 0.009, 0.003, 0.004, 0.004, 0.007, 0.012, 0.013, 0.01, 0.004, 0.003, 0.007, 0.004, 0.005, 0.007, 0.017, 0.011, 0.001, 0.002, 0.001, 0.001, 0.007, 0.004, 0.008, 0.007, 0.011, 0.013, 0.006, 0.007, 0.003, 0.002, 0.006, 0.003, 0.009, 0.006, 0.002, 0.015, 0.007, 0.002, 0.009, 0.013],